{
  "schema": "cftuv.envelope.ec0.case.v3",
  "case_id": "EC0-C11",
  "slug": "short-segment-owner",
  "title": "Endpoint ownership on a short segment",
  "status": "DEFINED",
  "global_contract_ids": [
    "EC0-G01",
    "EC0-G02",
    "EC0-G03",
    "EC0-G04",
    "EC0-G05",
    "EC0-G06",
    "EC0-G07",
    "EC0-G08",
    "EC0-G09",
    "EC0-G10"
  ],
  "semantic_contracts": [
    {
      "id": "EC0-C11-S1",
      "authority": "USER_REQUIRED",
      "rule": "Endpoint claims are EndpointClaimSeed records, not invalid one-incident CornerSeeds."
    },
    {
      "id": "EC0-C11-S2",
      "authority": "MATHEMATICALLY_REQUIRED",
      "rule": "All semantic records belong to one authoritative ID graph; result summaries only reference that graph."
    }
  ],
  "analysis_snapshot": {
    "patches": [
      {
        "id": "patch_main"
      }
    ],
    "patch_domains": [
      {
        "id": "domain_main",
        "owner_patch_id": "patch_main",
        "surface_regime": "INTRINSIC_PATCH_SURFACE",
        "boundary_constraint_ids": [
          "outer_boundary",
          "short_route_launch"
        ],
        "sectors": [
          {
            "id": "short_route_use_owner_sector",
            "chain_use_id": "short_route_use",
            "analysis_proven": true,
            "multiplicity_reason": "SINGLE_OWNER_INTERIOR_SECTOR"
          }
        ]
      }
    ],
    "source_vertices": [
      {
        "id": "short_start",
        "kind": "SOURCE_VERTEX"
      },
      {
        "id": "short_end",
        "kind": "SOURCE_VERTEX"
      }
    ],
    "physical_chains": [
      {
        "id": "short_route",
        "kind": "PHYSICAL_DECAL_SOURCE",
        "source_lineage": "short_route_physical_line"
      }
    ],
    "chain_uses": [
      {
        "id": "short_route_use",
        "physical_chain_id": "short_route",
        "owner_patch_id": "patch_main",
        "patch_domain_id": "domain_main",
        "orientation": "SEMANTIC_START_TO_END",
        "roles": [
          "DECAL_SOURCE"
        ],
        "launch_locus": {
          "boundary_id": "short_route_launch",
          "direction": "OWNER_INTERIOR",
          "source_support_non_blocking": true
        }
      }
    ],
    "boundary_constraints": [
      {
        "id": "outer_boundary",
        "constraint_kind": "PHYSICAL_DOMAIN_BARRIER",
        "owner": "NONE"
      },
      {
        "id": "short_route_launch",
        "constraint_kind": "SOURCE_LAUNCH_BOUNDARY",
        "owner": "NONE",
        "originating_chain_use_id": "short_route_use",
        "blocks_originating_seed": false,
        "blocks_other_fronts": true
      }
    ],
    "corner_relations": [],
    "junction_relations": []
  },
  "decal_request": {
    "decal_request_id": "request_main",
    "selected_chain_use_ids": [
      "short_route_use"
    ],
    "requested_alpha": "REQUEST_ALPHA",
    "join_policy": "CASE_DECLARED",
    "material_policy": "ONE_DECAL_REQUEST",
    "uv_policy": "SEMANTIC_STATION_FLOW"
  },
  "expected_compiled_plan": {
    "patch_evaluations": [
      {
        "id": "evaluation_main",
        "plan_key": {
          "decal_request_id": "request_main",
          "patch_domain_id": "domain_main"
        },
        "owner_patch_id": "patch_main",
        "source_seed_ids": [
          "front_seed_short_route_use",
          "endpoint_claim_seed_short_start",
          "endpoint_claim_seed_short_end"
        ],
        "seeds": [
          {
            "id": "front_seed_short_route_use",
            "kind": "FrontSeed",
            "chain_use_id": "short_route_use",
            "owner_patch_id": "patch_main",
            "sector_ids": [
              "short_route_use_owner_sector"
            ]
          },
          {
            "id": "endpoint_claim_seed_short_start",
            "kind": "EndpointClaimSeed",
            "source_vertex_id": "short_start",
            "chain_use_id": "short_route_use",
            "owner_patch_id": "patch_main"
          },
          {
            "id": "endpoint_claim_seed_short_end",
            "kind": "EndpointClaimSeed",
            "source_vertex_id": "short_end",
            "chain_use_id": "short_route_use",
            "owner_patch_id": "patch_main"
          }
        ],
        "front_components": [
          {
            "id": "front_component_short_route_use",
            "front_seed_id": "front_seed_short_route_use",
            "chain_use_id": "short_route_use",
            "owner_patch_id": "patch_main",
            "sector_id": "short_route_use_owner_sector",
            "active_interval_model": "CONTINUOUS_INTERVAL_SET",
            "initial_branch_count": 1,
            "branch_count_policy": "NON_INCREASING",
            "lifecycle": "COMPILE_TRACKED"
          }
        ],
        "coverage_contributions": [
          {
            "id": "strip_contribution_short_route_use",
            "kind": "StripEnvelope",
            "source_seed_id": "front_seed_short_route_use",
            "front_component_ids": [
              "front_component_short_route_use"
            ],
            "decal_request_id": "request_main",
            "patch_domain_id": "domain_main",
            "boundary_resolution": "REQUIRED_BEFORE_PATCH_UNION"
          }
        ],
        "boundary_events": [],
        "capacity_states": [
          {
            "front_component_id": "front_component_short_route_use",
            "requested_alpha": "REQUEST_ALPHA",
            "effective_alpha": "REQUEST_ALPHA",
            "capacity_reason": "NONE",
            "terminal_outcome": "NONE"
          }
        ],
        "patch_coverage": {
          "id": "patch_coverage_main",
          "decal_request_id": "request_main",
          "patch_domain_id": "domain_main",
          "operation": "EXACT_SINGLE_COVER_UNION",
          "contribution_ids": [
            "strip_contribution_short_route_use"
          ],
          "reachability": "PROVEN_FROM_SOURCE_SEEDS"
        },
        "interactions": [],
        "ownership": {
          "coverage_id": "patch_coverage_main",
          "total": true,
          "disjoint": true,
          "tie_boundary_owner": "NONE",
          "claims": [
            {
              "id": "claim_short_start",
              "source_seed_id": "endpoint_claim_seed_short_start",
              "coverage_id": "patch_coverage_main"
            },
            {
              "id": "claim_short_end",
              "source_seed_id": "endpoint_claim_seed_short_end",
              "coverage_id": "patch_coverage_main"
            }
          ]
        },
        "station_flow": {
          "authority": "SEMANTIC_CHAIN_USE_ORIENTATION",
          "longitudinal": "s",
          "transverse": "r",
          "storage_reversal_effect": "NONE"
        },
        "topology_events": [
          {
            "id": "body_collapse",
            "kind": "COLLAPSE",
            "exact_height_key": "ALPHA_BODY_COLLAPSE",
            "application": "AFTER_STATE_AT_EQUALITY"
          }
        ],
        "geometry_batch_provenance": {
          "decal_request_id": "request_main",
          "patch_domain_id": "domain_main",
          "patch_coverage_id": "patch_coverage_main"
        }
      }
    ]
  },
  "acceptance": {
    "coverage": "ONE_SHORT_STRIP",
    "ownership": "TWO_ENDPOINT_CLAIMS_MEET_AT_OWNERLESS_DIVIDER",
    "adjacency": [],
    "s_direction": "CLAIMS_MEET_WITHOUT_ID_TIE_BREAK",
    "alpha_evolution": [
      "BODY_PRESENT",
      "EQUALITY_DIVIDER",
      "BODY_COLLAPSED"
    ],
    "forbidden": [
      "ONE_INCIDENT_CORNER_SEED",
      "SMALLEST_ID_WINS"
    ]
  },
  "metamorphic_expectations": {
    "matrix_case_id": "EC0-C11",
    "matrix_file": "artifacts/envelope_ec0/corpus/matrices/metamorphic_matrix.json"
  },
  "canonical_geometry_digest": {
    "include": [
      "analysis_snapshot",
      "decal_request.decal_request_id",
      "expected_compiled_plan.patch_evaluations",
      "acceptance"
    ],
    "exclude": [
      "record_order",
      "runtime_face_order",
      "tessellation",
      "sampled_front_vertices",
      "presentation_visuals",
      "ui_state"
    ]
  }
}
